{
  "candidates": [
    {
      "error_rate": 0.0,
      "evidence_level": "screening",
      "evidence_state": "reproduced",
      "id": "sglang-0520-bf16-kv-nextn-k4-bounded-graphs",
      "lanes": [
        {
          "aggregate_output_tokens_per_second": 220.4148112194478,
          "concurrency": 1,
          "cost_per_1m_successful_output_tokens_usd": 5.7210311458812635,
          "gpu_seconds_per_successful_request": 6.2473115685,
          "independent_runs": 1,
          "itl_p95_ms": 4.921445312427323,
          "measurement_seconds": 74.967738822,
          "request_throughput_requests_per_second": 0.1600688534636513,
          "requests": 12,
          "slo_attainment": 1.0,
          "slo_goodput_requests_per_second": 0.1600688534636513,
          "slo_qualified_output_tokens_per_second": 220.4148112194478,
          "successful_requests": 12,
          "ttft_p95_ms": 243.69739144999585
        },
        {
          "aggregate_output_tokens_per_second": 670.968673571827,
          "concurrency": 4,
          "cost_per_1m_successful_output_tokens_usd": 1.8793723904980644,
          "gpu_seconds_per_successful_request": 2.0522567658333344,
          "independent_runs": 1,
          "itl_p95_ms": 6.505130090952039,
          "measurement_seconds": 24.627081190000013,
          "request_throughput_requests_per_second": 0.48726846301512494,
          "requests": 12,
          "slo_attainment": 0.75,
          "slo_goodput_requests_per_second": 0.3654513472613437,
          "slo_qualified_output_tokens_per_second": 503.2265051788703,
          "successful_requests": 12,
          "ttft_p95_ms": 1394.1695019999906
        }
      ],
      "origin": "infercrane_generated",
      "prompt_token_mismatch_rate": 0.0,
      "quality_gates": [
        {
          "name": "api_models",
          "passed": true
        },
        {
          "name": "stream_usage",
          "passed": true
        },
        {
          "name": "structured_output",
          "passed": true
        },
        {
          "name": "tool_call",
          "passed": true
        },
        {
          "name": "runtime_parity",
          "passed": true
        }
      ],
      "quality_passed": true,
      "recipe_digest": "sha256:20beced2343eb15326ffaf3df69fd798ab08929545d843eb97f0902971fba592",
      "runtime_id": "sglang-0.5.20-bf16-kv-nextn-k4-bounded-graphs",
      "workload_digest": "sha256:e875b5d44833f5ae727960e3963696e462b03e179b56f9a1bc3ed0e0158de55f"
    },
    {
      "error_rate": 0.0,
      "evidence_level": "screening",
      "evidence_state": "reproduced",
      "id": "sglang-0520-control",
      "lanes": [
        {
          "aggregate_output_tokens_per_second": 95.10826646234831,
          "concurrency": 1,
          "cost_per_1m_successful_output_tokens_usd": 13.258574116680043,
          "gpu_seconds_per_successful_request": 14.47823676341667,
          "independent_runs": 1,
          "itl_p95_ms": 10.329634516097387,
          "measurement_seconds": 173.73884116100004,
          "request_throughput_requests_per_second": 0.0690691840685173,
          "requests": 12,
          "slo_attainment": 1.0,
          "slo_goodput_requests_per_second": 0.0690691840685173,
          "slo_qualified_output_tokens_per_second": 95.10826646234831,
          "successful_requests": 12,
          "ttft_p95_ms": 239.68318674999978
        },
        {
          "aggregate_output_tokens_per_second": 338.7357596155714,
          "concurrency": 4,
          "cost_per_1m_successful_output_tokens_usd": 3.72266571864482,
          "gpu_seconds_per_successful_request": 4.065115538916667,
          "independent_runs": 1,
          "itl_p95_ms": 11.422482264462223,
          "measurement_seconds": 48.781386467000004,
          "request_throughput_requests_per_second": 0.24599546813040768,
          "requests": 12,
          "slo_attainment": 0.75,
          "slo_goodput_requests_per_second": 0.18449660109780575,
          "slo_qualified_output_tokens_per_second": 254.05181971167852,
          "successful_requests": 12,
          "ttft_p95_ms": 869.0550407499842
        }
      ],
      "origin": "infercrane_generated",
      "prompt_token_mismatch_rate": 0.0,
      "quality_gates": [
        {
          "name": "api_models",
          "passed": true
        },
        {
          "name": "stream_usage",
          "passed": true
        },
        {
          "name": "structured_output",
          "passed": true
        },
        {
          "name": "tool_call",
          "passed": true
        },
        {
          "name": "runtime_parity",
          "passed": true
        }
      ],
      "quality_passed": true,
      "recipe_digest": "sha256:a00e3958724ed80c6fd1f8b7a9e45281418428f9fa99df5c4d11dfb0c2cf9add",
      "runtime_id": "sglang-0.5.20",
      "workload_digest": "sha256:e875b5d44833f5ae727960e3963696e462b03e179b56f9a1bc3ed0e0158de55f"
    },
    {
      "error_rate": 0.0,
      "evidence_level": "screening",
      "evidence_state": "reproduced",
      "id": "sglang-0520-nextn-k4-bounded-graphs",
      "lanes": [
        {
          "aggregate_output_tokens_per_second": 216.2544195450894,
          "concurrency": 1,
          "cost_per_1m_successful_output_tokens_usd": 5.831094701567842,
          "gpu_seconds_per_successful_request": 6.367499923916668,
          "independent_runs": 1,
          "itl_p95_ms": 4.91378224694767,
          "measurement_seconds": 76.40999908700002,
          "request_throughput_requests_per_second": 0.1570475087473416,
          "requests": 12,
          "slo_attainment": 1.0,
          "slo_goodput_requests_per_second": 0.1570475087473416,
          "slo_qualified_output_tokens_per_second": 216.2544195450894,
          "successful_requests": 12,
          "ttft_p95_ms": 241.5557246499901
        },
        {
          "aggregate_output_tokens_per_second": 700.6052536842437,
          "concurrency": 4,
          "cost_per_1m_successful_output_tokens_usd": 1.7998723152143545,
          "gpu_seconds_per_successful_request": 1.9654434401666663,
          "independent_runs": 1,
          "itl_p95_ms": 5.761752295203496,
          "measurement_seconds": 23.585321281999995,
          "request_throughput_requests_per_second": 0.5087910339028641,
          "requests": 12,
          "slo_attainment": 0.9166666666666666,
          "slo_goodput_requests_per_second": 0.46639178107762536,
          "slo_qualified_output_tokens_per_second": 642.2214825438901,
          "successful_requests": 12,
          "ttft_p95_ms": 849.5916799500263
        }
      ],
      "origin": "infercrane_generated",
      "prompt_token_mismatch_rate": 0.0,
      "quality_gates": [
        {
          "name": "api_models",
          "passed": true
        },
        {
          "name": "stream_usage",
          "passed": true
        },
        {
          "name": "structured_output",
          "passed": true
        },
        {
          "name": "tool_call",
          "passed": true
        },
        {
          "name": "runtime_parity",
          "passed": true
        }
      ],
      "quality_passed": true,
      "recipe_digest": "sha256:9fab5190d65b83cdae0751a65af18cb35098b1be484ec577ea0ab25b7b20f6c6",
      "runtime_id": "sglang-0.5.20-nextn-k4-bounded-graphs",
      "workload_digest": "sha256:e875b5d44833f5ae727960e3963696e462b03e179b56f9a1bc3ed0e0158de55f"
    }
  ],
  "hardware_identity": "modal:NVIDIA H200:9.0",
  "model_identity": "Qwen/Qwen3.8-27B-FP8@017b9c7af6b5689d5dd426a76e0bc077eb5ca20a",
  "required_concurrency_lanes": [
    1,
    4
  ],
  "schema_version": "infercrane.dev/optimization-evidence/v1",
  "selection_policy": {
    "cost_tie_breaker": true,
    "evidence_level": "screening",
    "id": "workload-qualified-price-performance-screen-v1",
    "lane_aggregation": "arithmetic_mean",
    "objective": "minimum_cogs_under_slo",
    "qualification_before_scoring": true,
    "version": 1
  },
  "slo": {
    "max_error_rate": 0.01,
    "max_itl_ms": 12.0,
    "max_prompt_token_mismatch_rate": 0.0,
    "max_ttft_ms": 800.0,
    "min_successful_fraction": 0.99,
    "minimum_independent_runs": 1,
    "minimum_measurement_seconds_per_lane": 0.0,
    "minimum_requests_per_lane": 12,
    "required_quality_gates": [
      "api_models",
      "stream_usage",
      "structured_output",
      "tool_call",
      "runtime_parity"
    ],
    "scope": "each_concurrency_lane"
  },
  "workload_digest": "sha256:e875b5d44833f5ae727960e3963696e462b03e179b56f9a1bc3ed0e0158de55f",
  "workload_id": "agentic-system-chutes-public-decode-heavy-v1"
}
